{
  "schemaVersion": 1,
  "lastProjectReview": "2026-07-04",
  "status": "prototype",
  "summaryHr": "Projekt nije spreman za javno lansiranje kao javnozdravstvena kampanja.",
  "summaryEn": "The project is not ready to launch as a public health campaign.",
  "items": [
    {
      "id": "medical-review",
      "labelHr": "Medicinska provjera",
      "labelEn": "Medical review",
      "status": "blocked",
      "owner": "unassigned",
      "notesHr": "Potrebna je stručna provjera svih zdravstvenih tvrdnji na hrvatskom i engleskom.",
      "notesEn": "Qualified review is required for every health claim in Croatian and English."
    },
    {
      "id": "verified-croatian-routes",
      "labelHr": "Provjerene hrvatske rute skrbi",
      "labelEn": "Verified Croatian care routes",
      "status": "in progress",
      "owner": "unassigned",
      "notesHr": "Strukturirani imenik postoji, ali većina operativnih detalja ostaje označena kao potrebna provjera.",
      "notesEn": "A structured directory exists, but most operational details remain marked as needs verification."
    },
    {
      "id": "responsible-owner-contact",
      "labelHr": "Odgovorni vlasnik i javni kontakt",
      "labelEn": "Responsible owner and public contact",
      "status": "blocked",
      "owner": "unassigned",
      "notesHr": "Nije još imenovano — potrebno prije javnog lansiranja.",
      "notesEn": "Not assigned yet — required before public launch."
    },
    {
      "id": "accessibility-review",
      "labelHr": "Provjera pristupačnosti",
      "labelEn": "Accessibility review",
      "status": "in progress",
      "owner": "unassigned",
      "notesHr": "Postoje osnovne provjere i fokus stanja; formalna WCAG provjera još nije dovršena.",
      "notesEn": "Basic checks and focus states exist; a formal WCAG review is not complete."
    },
    {
      "id": "legal-privacy-review",
      "labelHr": "Pravna i privacy provjera",
      "labelEn": "Legal and privacy review",
      "status": "blocked",
      "owner": "unassigned",
      "notesHr": "Statički site nema obrasce/analitiku, ali peticija, kontakt ili embedovi zahtijevaju pregled.",
      "notesEn": "The static site has no forms/analytics, but petition, contact or embeds require review."
    },
    {
      "id": "user-testing",
      "labelHr": "Korisničko testiranje",
      "labelEn": "User testing",
      "status": "not started",
      "owner": "unassigned",
      "notesHr": "Testirati s anksioznim/urgentnim korisnicima, osobama koje traže prevenciju/testiranje i stakeholderima.",
      "notesEn": "Test with anxious/urgent users, prevention/testing users and stakeholders."
    },
    {
      "id": "stakeholder-review",
      "labelHr": "Stakeholder/NGO pregled",
      "labelEn": "Stakeholder/NGO review",
      "status": "not started",
      "owner": "unassigned",
      "notesHr": "Potrebna je provjera s relevantnim organizacijama i osobama pogođenima barijerama pristupa.",
      "notesEn": "Review is needed with relevant organizations and people affected by access barriers."
    },
    {
      "id": "naming-affiliation-review",
      "labelHr": "Pregled naziva i povezanosti",
      "labelEn": "Naming and affiliation review",
      "status": "blocked",
      "owner": "unassigned",
      "notesHr": "Treba potvrditi dopuštenja za nazive stvarnih usluga i spriječiti dojam partnerstva.",
      "notesEn": "Permissions for real-service names must be confirmed and affiliation confusion prevented."
    }
  ]
}
